{
  "evidence_id": "EVID-MIG-ARCHIVE-AURA-SPECIFICATION",
  "claim_id": "https://github.com/kamilkrasinski4-sys/aura-specification has root MIGRATION_NOTICE.md on main and GitHub repository metadata reports archived=true",
  "source_uri": "https://api.github.com/repos/kamilkrasinski4-sys/aura-specification",
  "source_revision": {
    "revision_type": "git_commit",
    "revision_id": "a39f58a603b6a682ae70be1f0141a7a7bf48415e",
    "repository": "kamilkrasinski4-sys/aura-specification",
    "path": "MIGRATION_NOTICE.md"
  },
  "content_digest": {
    "algorithm": "git-blob-sha1",
    "value": "6895ac04387be2e0b32dd103e3ea4905bd0646a9",
    "scope": "root MIGRATION_NOTICE.md blob at main following migration notice commit"
  },
  "evidence_availability": "PRESENT",
  "verification_result": "PASS",
  "verification_method": {
    "name": "Migration notice fetch + GitHub repository archived-flag read-back",
    "version": "GitHub REST API / Composio GitHub connection · 2026-10-20",
    "command_or_procedure": "Fetch root MIGRATION_NOTICE.md at main; verify it references vaidt/Projekt-Aura-BETA-; read repository metadata after archive action and check archived=true. Pre-notice baseline was 528de0de6d34a4a7ff541db9cd93238587dac9ef.",
    "environment": "GitHub API, owner-authorized account github_tanker-seem"
  },
  "scope_coverage": {
    "included": [
      "Migration notice present on default branch",
      "Migration notice commit follows stated pre-notice baseline",
      "GitHub repository metadata reports archived=true after archive action"
    ],
    "excluded": [
      "Full repository source equivalence with BETA",
      "Completeness of code/evidence migration",
      "Protocol normative authority or conformance",
      "External consumer dependency impact beyond this bounded review"
    ],
    "coverage_status": "EXHAUSTED_WITHIN_SCOPE"
  },
  "observed_at": "2026-10-20T16:08:00.873Z",
  "reviewer": "AURA BETA consolidation workflow",
  "limitations": [
    "Archive operation preserves repository/history but makes it read-only; this record does not prove all content has been copied to BETA.",
    "PASS refers only to existence of notice and archived=true metadata at observation time.",
    "BETA operational consolidation is not a ratified protocol source-of-truth declaration."
  ],
  "supersedes": [],
  "normative_effect": "NONE",
  "verification_artifact_uri": "https://github.com/kamilkrasinski4-sys/aura-specification/blob/main/MIGRATION_NOTICE.md",
  "notes": "Pre-notice baseline: 528de0de6d34a4a7ff541db9cd93238587dac9ef. Notice commit: a39f58a603b6a682ae70be1f0141a7a7bf48415e. Archive metadata was independently read back after the action and returned archived=true."
}
